{
  "schemaVersion": 1,
  "id": "semantic-annotations",
  "title": "Annotation summaries remain task-usable",
  "status": "active",
  "layer": "semantic",
  "capability": "annotations",
  "tools": ["read_pdf"],
  "matrixPaths": ["tools.read_pdf.include_annotations"],
  "mustHold": [
    "Admitted annotation fixtures expose at least one annotation summary under include_annotations",
    "Annotation presence supports agent citation/context tasks without exact PDF.js appearance-stream parity"
  ],
  "mayDiffer": [
    "Appearance stream precedence and named-state micro-details",
    "Bounding-box sub-pixel rounding"
  ],
  "failClosed": [
    "Hostile annotation materialization remains bounded"
  ],
  "evidence": {
    "kind": "task-eval",
    "suites": [
      "scripts/run-agent-task-smoke.ts",
      "scripts/run-agent-task-eval.ts"
    ]
  }
}
