{
  "schemaVersion": 1,
  "id": "semantic-form-fields",
  "title": "Form field summaries remain task-usable",
  "status": "active",
  "layer": "semantic",
  "capability": "form_fields",
  "tools": ["read_pdf"],
  "matrixPaths": ["tools.read_pdf.include_form_fields"],
  "mustHold": [
    "Admitted AcroForm fixtures expose form field summaries under include_form_fields",
    "Field presence supports agent questions about filled values without requiring exact PDF.js export-value quirks"
  ],
  "mayDiffer": [
    "Export-value normalization micro-details classified as pdfjs_implementation_non_goal",
    "Field id formatting within system-owned stability rules"
  ],
  "failClosed": [
    "Attachment/file bytes are not returned through form summaries"
  ],
  "evidence": {
    "kind": "task-eval",
    "suites": [
      "scripts/run-agent-task-smoke.ts",
      "scripts/run-agent-task-eval.ts"
    ]
  }
}
