{
  "schemaVersion": 1,
  "id": "semantic-public-url-corpus",
  "title": "Public URL PDF corpus remains task-usable under capability-first admission",
  "status": "active",
  "layer": "quality",
  "capability": "public_url_corpus",
  "tools": ["read_pdf", "search_pdf"],
  "matrixPaths": ["tools.read_pdf.include_full_text", "tools.search_pdf.literal_search"],
  "mustHold": [
    "SHA256-verified public URL cases from corpus/public-url-corpus.json support extract/search agent tasks",
    "Public tasks are opt-in and do not require vendored PDF bytes in the package",
    "Measured TS baseline floors gate pure-Rust public-task presence comparison"
  ],
  "mayDiffer": [
    "Whitespace and pagination micro-details across extractors",
    "Exact chunk boundaries and document-map representation details"
  ],
  "failClosed": [
    "Checksum mismatch rejects the public case",
    "Downloads require explicit opt-in"
  ],
  "evidence": {
    "kind": "task-eval",
    "suites": [
      "scripts/run-agent-task-eval.ts",
      "scripts/run-agent-task-smoke.ts",
      "corpus/public-url-corpus.json"
    ]
  }
}
