{
  "schemaVersion": 1,
  "id": "interface-mcp-surface",
  "title": "Public MCP tool surface compatibility",
  "status": "active",
  "layer": "interface",
  "capability": "mcp_surface",
  "tools": ["read_pdf", "search_pdf", "pdf_evidence"],
  "matrixPaths": ["tools.read_pdf", "tools.search_pdf", "tools.pdf_evidence"],
  "mustHold": [
    "Tool names remain read_pdf, search_pdf, and pdf_evidence for the published surface",
    "Required/optional input fields follow the published JSON Schema",
    "JSON-RPC/MCP envelopes and isError classification remain compatible",
    "Page numbers are 1-based",
    "System-owned IDs and provenance cannot be overwritten by provider output"
  ],
  "mayDiffer": [
    "Internal implementation field ordering inside unspecified objects",
    "Engine provenance labels that truthfully identify the Rust path"
  ],
  "failClosed": [
    "Unknown tool names are rejected",
    "Schema-invalid arguments fail closed"
  ],
  "evidence": {
    "kind": "interface-schema",
    "suites": [
      "test/production/productionPath.contract.test.ts",
      "scripts/check-production-contract.ts"
    ]
  }
}
