{
  "schemaVersion": 1,
  "id": "security-resource-bounds",
  "title": "Security and resource fail-closed bounds",
  "status": "active",
  "layer": "security",
  "capability": "security_bounds",
  "tools": ["read_pdf", "search_pdf", "pdf_evidence"],
  "matrixPaths": [
    "tools.read_pdf.url_ssrf",
    "tools.read_pdf.include_ocr_text_layer",
    "tools.pdf_evidence.analyze_regions"
  ],
  "mustHold": [
    "Source/page/candidate/region/render/provider budgets fail closed",
    "Provider argv remains direct with no shell execution",
    "URL sources preserve single-owner/single-fetch semantics where claimed",
    "Provider output cannot overwrite system identity or provenance"
  ],
  "mayDiffer": [
    "Exact warning wording outside frozen families"
  ],
  "failClosed": [
    "Over-cap hostile fixtures omit or reject the affected surface instead of partial corruption"
  ],
  "evidence": {
    "kind": "security-bound",
    "suites": [
      "scripts/differential/check-v3014-url-single-fetch-differential.ts",
      "scripts/differential/check-v3014-selectable-table-differential.ts"
    ]
  }
}
