{
  "schemaVersion": 1,
  "id": "semantic-table-structure",
  "title": "Selectable table structure usefulness",
  "status": "active",
  "layer": "semantic",
  "capability": "table_structure",
  "tools": ["read_pdf"],
  "matrixPaths": ["tools.read_pdf.include_tables", "tools.read_pdf.include_document_map"],
  "mustHold": [
    "Primary admitted tables are discoverable on the claimed fixture class",
    "Row/column/cell relationships remain coherent enough to answer table value questions",
    "Table evidence retains page association"
  ],
  "mayDiffer": [
    "Exact cell IDs",
    "Whitespace inside cells",
    "Table split/merge decisions outside the claimed fixture class",
    "Sub-pixel bounding boxes"
  ],
  "failClosed": [
    "Hostile over-cap table materialization remains rejected"
  ],
  "evidence": {
    "kind": "task-eval",
    "suites": [
      "scripts/differential/check-v3014-selectable-table-differential.ts",
      "scripts/run-agent-task-smoke.ts"
    ]
  }
}
