{
  "schemaVersion": 1,
  "id": "semantic-outline-headings",
  "title": "Outline/heading recovery remains task-usable",
  "status": "active",
  "layer": "semantic",
  "capability": "outline_headings",
  "tools": ["read_pdf"],
  "matrixPaths": ["tools.read_pdf.include_outline"],
  "mustHold": [
    "When a PDF exposes outline/bookmarks, read_pdf with include_outline returns at least one usable outline item",
    "Outline presence is evaluated by agent-task utility, not exact PDF.js title/string quirks"
  ],
  "mayDiffer": [
    "Exact title whitespace/punctuation",
    "Destination representation details within the same target page usefulness class"
  ],
  "failClosed": [
    "Malformed outline cycles remain bounded and do not hang the server"
  ],
  "evidence": {
    "kind": "task-eval",
    "suites": [
      "scripts/run-agent-task-smoke.ts",
      "scripts/run-agent-task-eval.ts"
    ]
  }
}
