{
  "schemaVersion": 1,
  "id": "semantic-search-relevance",
  "title": "Search relevance and page localization",
  "status": "active",
  "layer": "semantic",
  "capability": "search_relevance",
  "tools": ["search_pdf"],
  "matrixPaths": ["tools.search_pdf.literal_search", "tools.search_pdf.bounding_box"],
  "mustHold": [
    "Literal queries return matches on the correct page for claimed fixture classes",
    "Snippets are usable for agent quotation",
    "Page filters are applied before success reporting"
  ],
  "mayDiffer": [
    "Exact character offsets outside claimed families",
    "Bounding-box precision outside claimed geometry families",
    "Match ordering inside the same page when scores are equivalent"
  ],
  "failClosed": [
    "All-invalid page filters do not invent matches"
  ],
  "evidence": {
    "kind": "task-eval",
    "suites": [
      "scripts/differential/check-v3014-search-semantic-differential.ts",
      "scripts/run-agent-task-smoke.ts"
    ]
  }
}
